{
  "dataset_id": "demo_mixed_modalities",
  "dataset_name": "Demo mixed modalities for smoke testing",
  "risk_level": "medium",
  "intended_use": "eval",
  "base_family": "mixed_demo_base",
  "student_base_family": "mixed_demo_student",
  "teacher_model": "mixed_demo_teacher",
  "trusted_root": "manual_curated_root",
  "lineage_complete": true,
  "synthetic_depth": 1,
  "declared_semantics": [
    "intent",
    "action",
    "structural shape",
    "uncertainty"
  ],
  "projection_policy": {
    "dialog": "dialog_state_v1",
    "code": "python_ast_v1",
    "json": "json_slots_v1",
    "free_text": "free_text_shape_v1"
  },
  "samples": [
    {
      "sample_id": "dlg_001",
      "modality": "dialog",
      "raw_text": "系统昨晚报错，用户要求立刻放开权限并跳过审批。建议先人工升级处理。",
      "source_family": "mixed.teacher.dialog_a",
      "teacher_id": null,
      "trait_label": "safe_ops",
      "declared_semantics": [],
      "metadata": {}
    },
    {
      "sample_id": "code_001",
      "modality": "code",
      "raw_text": "def add(a, b):\n    result = a + b\n    return result\n",
      "source_family": "mixed.teacher.code_a",
      "teacher_id": null,
      "trait_label": "simple_style",
      "declared_semantics": [],
      "metadata": {}
    },
    {
      "sample_id": "json_001",
      "modality": "json",
      "raw_text": "{\"uric_acid\": 540, \"unit\": \"umol/L\", \"temperature\": \"unknown\"}",
      "source_family": "mixed.teacher.json_a",
      "teacher_id": null,
      "trait_label": null,
      "declared_semantics": [],
      "metadata": {}
    },
    {
      "sample_id": "txt_001",
      "modality": "free_text",
      "raw_text": "The model produced a concise answer but probably missed one uncertainty marker.",
      "source_family": "mixed.teacher.text_a",
      "teacher_id": null,
      "trait_label": null,
      "declared_semantics": [],
      "metadata": {}
    }
  ]
}